{
  "format": "evre-map/1",
  "device": "Example device",
  "device_id": "0x1001",
  "slave": 1,
  "login": { "addr": "0xF000", "size": 16 },
  "registers": [
    { "addr": "0xA000", "name": "DEVICE_ID", "type": "u16", "access": "ro", "group": "Protocol", "format": "hex",
      "plot": false, "desc": "which device this is" },
    { "addr": "0xA002", "name": "STATUS", "type": "u16", "access": "ro", "group": "Protocol",
      "desc": "protocol revision and capabilities",
      "fields": [ { "name": "protocol revision", "bits": "7:0" }, { "name": "CAP_ERROR_FRAME", "bits": "8" },
                  { "name": "CAP_BROADCAST", "bits": "9" }, { "name": "CAP_MSG", "bits": "10" },
                  { "name": "CAP_AUTO_SEND", "bits": "11" }, { "name": "CAP_DFU", "bits": "12" } ] },
    { "addr": "0xA004", "name": "CONFIG", "type": "u16", "access": "rw", "group": "Protocol", "danger": true,
      "fields": [ { "name": "HEARTBEAT", "bits": "0" }, { "name": "SYS_RESET", "bits": "1" },
                  { "name": "MSG_ENABLE", "bits": "2" }, { "name": "AUTO_SEND", "bits": "3" },
                  { "name": "DFU", "bits": "4" }, { "name": "AUTO_SEND prescaler", "bits": "15:8" } ] },
    { "addr": "0xA006", "name": "MSG_CNT", "type": "u8", "access": "rw", "group": "Protocol" },
    { "addr": "0xA007", "name": "MSG_BUFFER", "type": "bytes", "size": 255, "access": "rw", "group": "Protocol" },

    { "addr": "0xD000", "name": "UPTIME", "type": "u32", "unit": "ms", "access": "ro", "group": "System",
      "desc": "time since the device started" },
    { "addr": "0xD004", "name": "SUPPLY_V", "type": "f32", "unit": "V", "access": "ro", "group": "Power & supply" },
    { "addr": "0xD008", "name": "SUPPLY_I", "type": "f32", "unit": "A", "access": "ro", "group": "Power & supply" },
    { "addr": "0xD00C", "name": "TEMPERATURE", "type": "f32", "unit": "°C", "access": "ro", "group": "Sensors" },
    { "addr": "0xD010", "name": "STATE", "type": "u16", "access": "ro", "group": "System",
      "desc": "packed state word",
      "fields": [ { "name": "MODE", "bits": "1:0", "values": { "0": "idle", "1": "run", "2": "fault" } },
                  { "name": "READY", "bits": "2" }, { "name": "ALARM", "bits": "3" } ] },
    { "addr": "0xD012", "name": "COUNTER", "type": "u16", "access": "ro", "group": "System" },
    { "addr": "0xD014", "name": "PRESSURE", "type": "i16", "unit": "bar", "access": "ro", "group": "Sensors",
      "scale": 0.01, "desc": "sent in hundredths of a bar" },

    { "addr": "0xD080", "name": "SETPOINT", "type": "f32", "unit": "°C", "access": "rw", "group": "Settings",
      "min": -20, "max": 120, "default": 25, "decimals": 1 },
    { "addr": "0xD084", "name": "FAN_SPEED", "type": "u8", "unit": "%", "access": "rw", "group": "Settings",
      "min": 0, "max": 100, "default": 30, "persist": true },
    { "addr": "0xD085", "name": "LED_MODE", "type": "u8", "access": "rw", "group": "Settings",
      "enum": { "0": "off", "1": "on", "2": "blink" } },
    { "addr": "0xD086", "name": "MOTOR_SPEED", "type": "i16", "unit": "rpm", "access": "rw", "group": "Settings",
      "danger": true, "desc": "moves the motor: confirmed on every write" }
  ]
}
